trimmed_line,is_title,title,index,abstract,article_type,authors,document_type,issue,place_ofpublication,date,pubtitle,year,volume
62. Gaylon Alcaraz's radical journey,TRUE,Gaylon Alcaraz's radical journey,61,"Do you know who Nico Tortorella is? He's a kinda hot actor who appears on Younger and has come out as sexually fluid-so I guess we now have to add an F to the already cumbersome LGBTQIA; he also has a podcast called ""The Love Bomb."" A recent guest was someone who knows a thing or two about sexual fluids-gay-porn actor Colby Keller. Colby shared his coming-out story with Nico. As a kid, Keller had a box of gay porn under his bathroom sink.",Newspapers,"Masters, Billy",Commentary,18,"Chicago, Ill.","Jan 18, 2017",Windy City Times,2017,32
63. COMMUNITY CALENDAR,TRUE,COMMUNITY CALENDAR,62,"I'm a radical,"" said [Gaylon Alcaraz]. ""I'm not a traditionalist and a lot of these non-for-profit organizations are very traditional and capitalist; and that's not who I am. One of the main things that Project Fierce does is we do not take any governmental grants because of the capitalism. They brought this building out right from fundraising and I am drawn to that. That is a new way to look at the world around us. We don't need capitalism.",Newspapers,"Wasserman, Melissa",Feature,9,"Chicago, Ill.","Nov 23, 2016",Windy City Times,2016,32
64. Fused Muse brings audiences to 'Edge of Shelter',TRUE,Fused Muse brings audiences to 'Edge of Shelter',63,"Queer Genre Fiction Book Discussion Group A discussion of Breakfast On Pluto by Patrick McCabe. Bring yourself, a friend, and make few new ones. 7:00pm ^Gerber Hart Library and Archives 6500 N Clark St Chicago https://www.facebook. com/events/381222225601229/",Newspapers,Anonymous,General Information,7,"Chicago, Ill.","Nov 9, 2016",Windy City Times,2016,32
65. Dems triumph in Illinois races,TRUE,Dems triumph in Illinois races,64,"Individual YEPP members were teamed with professional musicians from Chicago,"" [Iddo Aharony] said. ""Each one created a new performative work based on life-experiences. This kind of collaborative work was new and we didn't know how or if it was going to work. Nobody knew what to expect in the first meeting where we had people of different socio-economic backgrounds, race and gender. Yet, for me, it was one of the most magical experiences I've ever had.",Newspapers,"Hammond, Gretchen Rachel",News,7,"Chicago, Ill.","Nov 9, 2016",Windy City Times,2016,32
66. 24th District incumbent faces a challenge,TRUE,24th District incumbent faces a challenge,65,"As President, I'll make fighting discrimination against the LGBT community a top priority-including by working with Congress to pass the Equality Act,"" [Hillary Rodham Clinton] said. ""And we won't stop there. We'll also take on harassment, bullying, and violence-and youth homelessness, which disproportionately hurts LGBT kids.",Newspapers,"Simonette, Matt;Hammond, Gretchen Rachel",News,7,"Chicago, Ill.","Nov 9, 2016",Windy City Times,2016,32
67. Love and violence in Black LGBTQ communities,TRUE,Love and violence in Black LGBTQ communities,66,"EH: I would and I have. [Andy Kirchoff] has to make me look like I'm not my own person. I did not get into office very easily and it wasn't through the help of [Madigan]. The first time I threw in my hat was in 2002 and there was no incumbent. I saw an opportunity for change, however I didn't win even on the second time because I was working against a very hard machine. I am not a Madigan follower.",Newspapers,"Hammond, Gretchen Rachel",Interview,5,"Chicago, Ill.","Oct 26, 2016",Windy City Times,2016,32
"68. Sarah Schulman discusses queer culture, 'Conflict'",TRUE,"Sarah Schulman discusses queer culture, 'Conflict'",67,"The 2014 Advocate article ""2 Studies That Prove Domestic Violence is an LGBT issue"" reports that ""21.5 percent of men and 35.4 percent of women living with a same-sex partner experienced intimate-partner physical violence in their lifetimes. ...",Newspapers,"Monroe, Irene",Commentary,5,"Chicago, Ill.","Oct 26, 2016",Windy City Times,2016,32
69. MAP report shows shocking disparities in the bisexual community,TRUE,MAP report shows shocking disparities in the bisexual community,68,"Sarah Schulman describes herself, and her work, as unorthodox. ""I mean, this has been one of the problems my whole life. I don't write books that take an already established position in an argument,"" said Schulman. ""All of my books initiate a new frame. This is true of my book on familial homophobia, of my book on gentrification, of my book about the Palestinian Queer movement.",Newspapers,"Baudler, Liz",News,4,"Chicago, Ill.","Oct 19, 2016",Windy City Times,2016,32
70. Dawn Valenti: A Chicago survivor's story,TRUE,Dawn Valenti: A Chicago survivor's story,69,"There's almost like a double-closeting effect,"" she added. ""It's difficult to be out as bisexual when you have so much judgment about bisexual people, not just from the heterosexual community, but from the gay and lesbian community. If a woman is bisexual, lesbians look at her like she is less legitimate.",Newspapers,"Hammond, Gretchen Rachel",News,3,"Chicago, Ill.","Oct 12, 2016",Windy City Times,2016,32
"71. Rita Adair talks activism, upcoming book, social work",TRUE,"Rita Adair talks activism, upcoming book, social work",70,"I don't, I don't, I don't,"" she repeated emphatically. ""Because I have to be their strength. I can't break down. But there's times when I leave the family and I'm in my car down the street and I break down or I go home and I just shut it down. To hear a woman say 'I thought giving birth was the worst thing I had to do' after she walks out of the medical examiner's office identifying her son is hard for me.",Newspapers,"Hammond, Gretchen Rachel",Feature,3,"Chicago, Ill.","Oct 12, 2016",Windy City Times,2016,32
"72. Activist Rachel Williams talks #SayHerName, BYP100, intersectionality",TRUE,"Activist Rachel Williams talks #SayHerName, BYP100, intersectionality",71,"To join WACT, visit https://www.facebook. com/groups/152344554812622/. More info about Lez In Color is at https://www.facebook.com/groups/LezInColor/.",Newspapers,"Maxwell, Carrie",Feature,43,"Chicago, Ill.","Jul 20, 2016",Windy City Times,2016,31
73. Chicago's Latino community stands with the LGBTQ Latino community,TRUE,Chicago's Latino community stands with the LGBTQ Latino community,72,"""I don't have plans to finish my degree at this point of my life,"" said [Rachel Williams]. ""Maybe one day when or if college education doesn't equal debt and having to hold off building a family because of the debt that you acquired trying to subscribe to a fake-ass American dream. Plus a degree shouldn't define your intelligence or worth in a capitalistic society.""",Newspapers,"Maxwell, Carrie",News,43,"Chicago, Ill.","Jul 20, 2016",Windy City Times,2016,31
74. Making sense of senseless acts,TRUE,Making sense of senseless acts,73,"Even though this weekend's violent shooting was perhaps the most devastating, it was not an isolated event-violence towards the LGBTQ community is rampant. LGBTQ people are twice as likely to be victims of hate crimes, compared to other marginalized communities. For LGBTQ Latinos who experience racism, homophobia, and transphobia, the violence is far too common.",Newspapers,Anonymous,Feature,39,"Chicago, Ill.","Jun 22, 2016",Windy City Times,2016,31
75. 'Mudderella' June 4,TRUE,'Mudderella' June 4,74,"A history of violence courses through the veins of the LGBTQIA community-in Chicago, nationally and internationally. The victims and survivors have come from every letter of the LGBTQIA alphabet, every race, class, religion, ethnicity, ability and age. Some have made headlines, such as Matthew Shepard and Brandon Teena, or those 32 people killed in 1973 at a gay bar in New Orleans-up until this week, the largest single targeted murder of LGBTQIAs in history.",Newspapers,"Baim, Tracy",Commentary,38,"Chicago, Ill.","Jun 15, 2016",Windy City Times,2016,31
76. Talking with prison abolitionist Mariame Kaba,TRUE,Talking with prison abolitionist Mariame Kaba,75,Mudderella events are non-competitive challenges designed to empower women to work together while overcoming obstacles and having fun.,Newspapers,Anonymous,News,34,"Chicago, Ill.","May 18, 2016",Windy City Times,2016,31
"77. Assault, violence groups release statement",TRUE,"Assault, violence groups release statement",76,"Ever since I've known her, [Mariame Kaba]'s always been there doing that work with organizations like Broadway Youth Center and Young Women's Action Team, and has always been actively engaged in supporting and collaborating with youth around these issues. So it's not surprising that she has helped create a large cadre of people who are now doing so much radical work: she's deep rooted in their organizations.",Newspapers,"Nair, Yasmin",Commentary,33,"Chicago, Ill.","May 11, 2016",Windy City Times,2016,31
78. 'Mudderella' June 4,TRUE,'Mudderella' June 4,77,"Safety and privacy are important for all of us,"" said Terri Poore, policy director at the National Alliance to End Sexual Violence. ""Passing laws like the one in North Carolina to harm transgender people, or denying them protection from discrimination, does nothing to help survivors of violence...",Newspapers,Anonymous,General Information,31,"Chicago, Ill.","Apr 27, 2016",Windy City Times,2016,31
79. Activist/scholar Richie keynotes International Women's Day event,TRUE,Activist/scholar Richie keynotes International Women's Day event,78,Mudderella events are non-competitive challenges designed to empower women to work together while overcoming obstacles and having fun.,Newspapers,Anonymous,News,30,"Chicago, Ill.","Apr 20, 2016",Windy City Times,2016,31
80. in the LIFE: Kyle J Krueger,TRUE,in the LIFE: Kyle J Krueger,79,"To commemorate International Women's Day; the YWCA Evanston/North Shore, Northwestern University Women's Center, The Woman's Club of Evanston, Evanston Women's History Project, Frances Willard Historical Association, the League of Women Voters of Evanston and the City of Evanston co-sponsored a breakfast event featuring a keynote address, ""Gender Violence: Addressing Injustice,"" by activist, author and scholar Beth E.",Newspapers,"Maxwell, Carrie",News,25,"Chicago, Ill.","Mar 16, 2016",Windy City Times,2016,31
"81. Affinity holds annual Burning Bowl, names new director",TRUE,"Affinity holds annual Burning Bowl, names new director",80,"""It's really just a job,"" [Kyle J. Krueger] said. ""A lot of these guys have become my good friends, so I'm quite used to seeing the guys and getting up in their business to paint them. To me it's just a 3D canvass. It's hard to think of anything else in the moment when getting them painted and dressed in short amounts of time.",Newspapers,"Forman, Ross",Feature,17,"Chicago, Ill.","Jan 20, 2016",Windy City Times,2016,31
82. ASK A FEMINIST,TRUE,ASK A FEMINIST,81,"For Affinity, Black lives have always mattered,"" [Rupert-Gordon] added. ""That's what makes me proud of, not just our past, but for our future. In the next 20 years, we will continue to serve in trans communities, we will prioritize Black voices and highlight the experiences of lesbian, bisexual and queer women. We will work to eliminate wage gaps and experience education. We will work to ensure that people like us are informed about voting and policies that matter to us.",Newspapers,"Hammond, Gretchen Rachel",News,16,"Chicago, Ill.","Jan 13, 2016",Windy City Times,2016,31
"83. Chicago homeless, advocates confront Ald. Cappleman",TRUE,"Chicago homeless, advocates confront Ald. Cappleman",82,"CC: I'm still struggling to figure it out as well. To me it's the difference or the tension between a women's rights politics and a feminist politics, or an LGBT politics and a queer politics. What I'm looking for and have found, I hope, is a radical trans feminist politics that is thinking about and rooted in the transformation of institutions that would oppress and limit people's understanding and performance of gender.",Newspapers,"Cohen, Cathy J;Jackson, Sarah J",Interview,14,"Chicago, Ill.","Dec 30, 2015",Windy City Times,2015,31
"84. Steinem, Gay talk with sold-out Chicago audience",TRUE,"Steinem, Gay talk with sold-out Chicago audience",83,"[Robert] claimed that he and others have tried to approach [Cappleman] about the issue numerous times. ""We've gone to his office and he's never available,"" Robert said. ""He doesn't want to claim responsibility. I'm not a criminal. I'm homeless. A lot of us just had a bad break. Cappleman wants to close the shelters down. Where are we supposed to go? If Cappleman had to spend a day out here living like we did, he'd know what it is like.""",Newspapers,"Hammond, Gretchen Rachel",News,8,"Chicago, Ill.","Nov 18, 2015",Windy City Times,2015,31
85. New study aims to improve health care for LGBT people of color,TRUE,New study aims to improve health care for LGBT people of color,84,"""What seems to be one thing in the distance is very different close-up,"" [Steinern] quoted. ""I tell you this story because it's the kind of lesson that can only be learned on the road. And also because I've come to believe that, inside, each of us has a purple motorcycle. We only have to discover it and ride.""",Newspapers,"Hammond, Gretchen Rachel",News,6,"Chicago, Ill.","Nov 4, 2015",Windy City Times,2015,31
86. letters,TRUE,letters,85,"In order to identify and recruit participants, [Marshall Chen] and his colleagues called in the Morten Group. Founded by Mary Morten, who formerly served as Mayor William M. Daley's liaison to the LGBT community, the Morten Group previously conducted the 2013 LGBT Needs Assessment, identifying the concerns of Chicagoland's LGBT population. ""We learned through the needs assessment that healthcare was the number one issue,"" Morten said.",Newspapers,"Baker-Jordan, Skylar",News,5,"Chicago, Ill.","Oct 28, 2015",Windy City Times,2015,31
87. Windy City Times at 30,TRUE,Windy City Times at 30,86,"Affinity's constituents and donors have been a supreme pleasure to work with over the years. There are foundations that have invested in Affinity early on and for multiple years-Alphawood, Astraea, Chicago Foundation for Women, Crossroads Fund, Woods Fund of Chicago. And to be notified that Affinity was one of the grantees in the very first funding round of the Chicago Community Trust's LGBT Fund was a beautiful moment.",Newspapers,"Hunt, Kim L",Letter,2,"Chicago, Ill.","Oct 7, 2015",Windy City Times,2015,31
88. 19th transgender murder raises questions about reporting,TRUE,19th transgender murder raises questions about reporting,87,"As for [Jeff McCourt], his last years were lonely and painful. [Mike Miner], in his Reader obituary May 7, 2007, wrote: ""McCourt had one friend at the end, possibly the only one who knew about his death when it happened.",Newspapers,"Baim, Tracy",Feature,52,"Chicago, Ill.","Sep 23, 2015",Windy City Times,2015,30
89. Demystifying sexual abuse in the LGBTQ community,TRUE,Demystifying sexual abuse in the LGBTQ community,88,"In the 1970s and '80s, computers didn't have the power to search everything,"" he said. ""We had to narrow the search down as much as we could and so we used sex, race or sometimes year-of-birth as a filter so that we weren't looking for a needle in the biggest haystack. Race was always something that could be subjective. How was it designated in the database? When you didn't know that, there was a chance that you would miss it in the search.",Newspapers,"Hammond, Gretchen Rachel",News,51,"Chicago, Ill.","Sep 16, 2015",Windy City Times,2015,30
90. COMMUNITY CALENDAR,TRUE,COMMUNITY CALENDAR,89,"Sexual abuse is a difficult topic for anyone to talk about. It evokes a lot of fear, confusion, anger, and shame-a potent mix that helps keep the topic out of our daily conversations. But sadly, abuse is part of our everyday world,"" Research Psychologist Dr. Nina Burrowes said. ""It's a statistical inevitability that all of us have people in our lives who have experienced abuse-especially within the LGBT community.",Newspapers,"Toce, Sarah",News,45,"Chicago, Ill.","Aug 5, 2015",Windy City Times,2015,30
91. Leaders reflect on activism as organization folds,TRUE,Leaders reflect on activism as organization folds,90,"Queer, III and Okay 2015 Annual multidisciplinary performance series exploring, challenging, and reinventing narratives about the lives of queer individuals and their relationships to HIV and other forms of mental and chronic illness. 7:30pm DCA Storefront Theater 66 E Randolph St Chicago https://www.facebook.com/ events/920311198012717/",Newspapers,Anonymous,General Information,43,"Chicago, Ill.","Jul 22, 2015",Windy City Times,2015,30
92. Commissioner launches Off the Sidelines-Chicago,TRUE,Commissioner launches Off the Sidelines-Chicago,91,"After the archiving event I was just in awe of the community stepping up and sharing what Amigas Latinas has meant to them,"" said [Alma Izquierdo]. ""To hear an individual who was at a very challenging and difficult point in their life tell their story and just knowing that Amigas Latinas was there to help them that to me is the epitome of what Amigas Latinas has meant to the community. It's really had an impact on the LGBTQ community here in Chicago and across the United States.",Newspapers,"Maxwell, Carrie",News,41,"Chicago, Ill.","Jul 8, 2015",Windy City Times,2015,30
93. Deborah's Place marks 30 years fighting for homeless women,TRUE,Deborah's Place marks 30 years fighting for homeless women,92,"Mikva Challenge leader and Lindblom Math &amp; Science Academy junior Heaven Johnson said: ""For me, sexual education for teenagers is an issue that's close to my heart and one that I'm hoping more Chicago girls and women take action on.",Newspapers,Anonymous,News,37,"Chicago, Ill.","Jun 10, 2015",Windy City Times,2015,30
"94. Griner, Johnson under seven-game suspension",TRUE,"Griner, Johnson under seven-game suspension",93,"[Deborah]'s Place Learning Centers help women connect to the rich diversity of arts and culture that the rest of Chicago's residents and tourists take for granted, whether that is tickets to a play, museum or Cubs game. ""You might be dealing with homelessness but you are a citizen and all citizens have a right to what author Earl Shorris called 'the life of the downtown',"" [Audrey Thomas] said. ""Homeless people feel isolated from arts and culture.",Newspapers,"Hammond, Gretchen Rachel",News,35,"Chicago, Ill.","May 27, 2015",Windy City Times,2015,30
"95. Griner, Johnson tie the knot",TRUE,"Griner, Johnson tie the knot",94,"[Laurel J. Richie] also said that [Brittney Griner] pled guilty April 28 in Goodyear City Court to misdemeanor disorderly conduct; Griner has to complete a 26-week course and, upon doing so, the disorder-conduct charge will be dismissed. Johnson's case (transferred to county court) is pending.",Newspapers,Anonymous,News,34,"Chicago, Ill.","May 20, 2015",Windy City Times,2015,30
96. Amigas Latinas to fold after 20 years; last event July 10,TRUE,Amigas Latinas to fold after 20 years; last event July 10,95,"People.com reported that, as about 75 guests looked on, the brides, both 24, were married beneath an archway at the Pointe Hilton Tapatio Cliffs Resort. Their first dance was to Ed Sheeran's ""Thinking Out Loud.""",Newspapers,Anonymous,News,33,"Chicago, Ill.","May 13, 2015",Windy City Times,2015,30
97. Jussie Smollett and Yazz: Lyons rule 'Empire',TRUE,Jussie Smollett and Yazz: Lyons rule 'Empire',96,"In recent years, Amigas Latinas found it increasingly difficult to maintain earlier levels of programming and advocacy. ""We struggled with this decision,"" says [Alma Izquierdo], ""because we know that there are still women out there who haven't found the community or the support they need to come out as LGBTQQ Latinas."" At the same time, the board notes that over the past 20 years there has been a significant expansion in the availability of services to LGBTQ Latinos in Chicago.",Newspapers,Anonymous,News,32,"Chicago, Ill.","May 6, 2015",Windy City Times,2015,30
98. Longtime political activist Jean Hardisty dies,TRUE,Longtime political activist Jean Hardisty dies,97,"[Jussie Smollett]: I'm excited because there's so much more to come. The dope thing about season one is there are so many questions still to be answered. I feel like season one was the set-up and then season two will be, ""Let's go back and let's clean up all of the Lyon's stuff."" I'm very happy where [Jamal]'s journey has taken him from beginning to now, and where it's going to end up going.",Newspapers,"Nunn, Jerry",Interview,28,"Chicago, Ill.","Apr 8, 2015",Windy City Times,2015,30
"99. U.S. murders of trans, gender-exploring people continue",TRUE,"U.S. murders of trans, gender-exploring people continue",98,"In PRA's 10-year anniversary report in 1991, four years after the agency moved from Chicago to the Boston area, Hardisty wrote that the agency had grown and had a major impact, but at the same time, ""Each year has been more depressing and alarming that the Last.",Newspapers,"Baim, Tracy",Obituary,26,"Chicago, Ill.","Mar 25, 2015",Windy City Times,2015,30
100. HUD tells homeless shelters to respect self-identified gender,TRUE,HUD tells homeless shelters to respect self-identified gender,99,"In the [Brian Golee] case, both national and international media Leaped on the story but with no accord as to [Golec]'s own preference, they scrambled for a label regardless of assertions and desperate pleas to stop made by Golec's own family, fiancée and friends.",Newspapers,"Hammond, Gretchen Rachel",News,22,"Chicago, Ill.","Feb 25, 2015",Windy City Times,2015,30
101. Out gay candidate makes play for 15th Ward seat,TRUE,Out gay candidate makes play for 15th Ward seat,100,"""While we welcome the new HUD guidance, we will also continue to improve our staff and volunteers' awareness of gender inclusion, ensuring that all female-identified and nonbinary individuals find a welcoming, supportive community at [Deborah]'s Place. We also believe that shelters are only a temporary and short-term solution to the complex problem of homelessness. ALL people need access to safe, affordable housing and supportive services to help them remain housed.""",Newspapers,"Davis, Andrew",News,22,"Chicago, Ill.","Feb 25, 2015",Windy City Times,2015,30
102. Sam Smith star of the Grammys,TRUE,Sam Smith star of the Grammys,101,"With domestic violence, I'm very well-connected with Clara's House, the oldest domestic violence shelter in Englewood. This year, Mrs. Kirk, their founder, derided to team up with members of the PRCC [Puerto Rican Cultural Center]-Project VIDA. I met with a number of their people, they were here in the ward, and they were mentioning about transgender domestic violence, those issues.",Newspapers,"Simonette, Matt",Interview,21,"Chicago, Ill.","Feb 18, 2015",Windy City Times,2015,30
103. TPAN receives $115K from Alphawood,TRUE,TPAN receives $115K from Alphawood,102,"In addition, Tony Bennett and Lady Gaga per- formed their rendition of the jazz tune ""Cheek to Cheek""; Rihanna joined Kanye West and Paul McCartney to perform ""FourFiveSeconds"" and No Doubt frontwoman Gwen Stéfani and Ma- roon 5 frontman Adam Levine-both judges on NBC's The Voice-sang ""My Heart is Open."" The night ended with Beyonce and gospel sing- ers singing the hymn ""Precious Lord, Take My Hand,"" before artists Common and John Legend performed their Oscar-nominated...",Newspapers,Anonymous,News,20,"Chicago, Ill.","Feb 11, 2015",Windy City Times,2015,30
104. Letters to the editor,TRUE,Letters to the editor,103,"For more than 27 years, TPAN has delivered HIV/AIDS-related programs for hundreds of individuals each year who are Living below the federal poverty Level and impacted by HIV/AIDS.",Newspapers,Anonymous,News,19,"Chicago, Ill.","Feb 4, 2015",Windy City Times,2015,30
105. Chicago Women Take Action forum hosts mayoral candidates,TRUE,Chicago Women Take Action forum hosts mayoral candidates,104,"Since 2009, Executive Director Kim Hunt's implementation of Affinity's various organizational programming includes the proposed ""Civic 101 workshops as well as past programs such as the Domestic Violence Sunday sermons, the ""It Takes a Village"" program and the various research projects. These are all perfect examples of how a grassroots community-service organization's vision can be relevant, Long-term and sustainable.",Newspapers,"O'Connor, Michael",Letter,18,"Chicago, Ill.","Jan 28, 2015",Windy City Times,2015,30
106. Intimate partner violence report out,TRUE,Intimate partner violence report out,105,"Expressing his disappointment in [Rahm Emanuel] for his closure of fifty schools, [Willie L. Wilson] said that he would approach the issue of education funding from a ""business perspective not a poLitidans perspective."" Thus he proposed opening up a water-based Casino in the dty. ""We would also Lower taxes,"" he added. ""Most of dtizens drive into neighboring suburbs to buy gasoline because the taxes are so high.""",Newspapers,"Hammond, Gretchen Rachel",News,18,"Chicago, Ill.","Jan 28, 2015",Windy City Times,2015,30
107. Dear White People; Nightcrawler; film note,TRUE,Dear White People; Nightcrawler; film note,106,"Center on Halsted emailed to Windy City Times, ""The report yet again illustrates that violence within LGBTQ relationships is often ignored and lacks visibility, both within and outside of various communities.",Newspapers,Anonymous,News,6,"Chicago, Ill.","Nov 5, 2014",Windy City Times,2014,30
