trimmed_line,is_title,title,index,abstract,article_type,authors,document_type,issue,place_ofpublication,date,pubtitle,year,volume
"108. Chicago lesbian joins NFL domestic-violence, sexual-assault group",TRUE,"Chicago lesbian joins NFL domestic-violence, sexual-assault group",107,Although the characters aren't particularly complex-each seeming to represent a spedfic point [Justin Simien]'s wants to make about radsmhis ear for sharp retorts keeps the catchy dialogue consistently fresh and funny.,Newspapers,"Knight, Richard, JR",Film Review,6,"Chicago, Ill.","Nov 5, 2014",Windy City Times,2014,30
109. Intimate partner violence report out,TRUE,Intimate partner violence report out,108,"Richie admitted that she ""sort of wondered"" about being chosen by the NFL, being an out Lesbian. ""If I had more time to do this [job], and was going to be doing it for a Longer time, I would want to push really hard on the questions around sexuality in this, particularly, hyper masculinity. You can't ignore it or deny it,"" Richie said. ""At its root, what we're dealing with is, questions about masculinity, right alongside race and power.""",Newspapers,"Forman, Ross",News,6,"Chicago, Ill.","Nov 5, 2014",Windy City Times,2014,30
110. CALENDAR,TRUE,CALENDAR,109,NCAVP's 2013 report documents 21 homicides-the highest number of LGBTQ intimate partner violence (IPV) homicides recorded and on par with the 21 homicides in 2012.,Newspapers,Anonymous,News,4,"Chicago, Ill.","Oct 22, 2014",Windy City Times,2014,30
111. UIC policy expert named to NFL's violence panel,TRUE,UIC policy expert named to NFL's violence panel,110,"Night of 100 Drag Queens 2014: Animal Queendom Annual two-night benefit extravaganza for Equality Illinois. 7 pm VIP reception, gen. adm. at 8pm. Tickets available in advance from Sidetrack bartenders and online. Hosted by Debbie Fox and Tequila Mockingbird. Directed by Jeff Lynch. See ad in Nightspots or Sidetrack website for full list of performers. 7:00pm - 11:00pm Sidetrack 3349 N Habted St Chicago http://www.sidetrackchicago.com",Newspapers,Anonymous,General Information,4,"Chicago, Ill.","Oct 22, 2014",Windy City Times,2014,30
112. Facebook trying to fix policy,TRUE,Facebook trying to fix policy,111,"""The problem of violence, particularly against women and children, can't simply be addressed by public polices relying on incarceration. So it's important for organizational and grassroots efforts to take into account the need for education, resources, outreach and social change,"" said [Beth Richie], who is professor of African-American studies; criminology, law, and justice; and gender and women's studies at UIC.",Newspapers,Anonymous,News,2,"Chicago, Ill.","Oct 8, 2014",Windy City Times,2014,30
113. CALENDAR,TRUE,CALENDAR,112,"""Our policy has never been to require everyone on Facebook to use their Legal name,"" [Chris Cox] noted. ""The spirit of our policy is that everyone on Facebook uses the authentic name they use in real life. For Sister Roma, that's Sister Roma. For Lil Miss Hot Mess, that's Lil Miss Hot Mess. Part of what's been so difficult about this conversation is that we support both of these individuals, and so many others affected by this, completely and utterly in how they use Facebook.""",Newspapers,"Simonette, Matt",News,2,"Chicago, Ill.","Oct 8, 2014",Windy City Times,2014,30
114. Billie Jean King takes fair shot at equality at luncheon,TRUE,Billie Jean King takes fair shot at equality at luncheon,113,"Bi discussion group Every other Tuesday, chat about upcoming bisexual events, concerns, and answer each other's questions about the community. Soft drinks, water are provided by the Center, or bring anything else you'd like to share, whether it's snacks or a good book! 7:00pm - 9:00pm Center on Halsted 3656 N Halsted Chicago http://www.centeronhabted.org",Newspapers,Anonymous,General Information,1,"Chicago, Ill.","Oct 1, 2014",Windy City Times,2014,30
115. Honors roll in for UIC researcher,TRUE,Honors roll in for UIC researcher,114,"""More than half of our minimum-wage workers are women,"" [Pat Quinn] said. ""It's very important that we in Illinois work together to raise the minimum wage and pass it by the end of this year in the General Assembly."" He also stressed that keeping women safe from the debilitating horrors wrought by domestic violence should be a goal shared by both the state and the country as a whole. ""I've had a chance to visit some who are on the front Lines making sure we protect all women...",Newspapers,"Blickensderfer, Gretchen Rachel",Feature,52,"Chicago, Ill.","Sep 24, 2014",Windy City Times,2014,29
116. Montrose Rocks annual event faces uncertain future,TRUE,Montrose Rocks annual event faces uncertain future,115,"[Tonda L. Hughes]' research dates back to the early 1990s. She said the UIC award ""Legitimizes my work."" Plus, being the first honoree is not Lost on Hughes ""because we have a number of really excellent, highly recognized national and international researchers in the college.""",Newspapers,"Forman, Ross",News,47,"Chicago, Ill.","Aug 20, 2014",Windy City Times,2014,29
117. AFC event 'Ignites' group's 30th anniversary,TRUE,AFC event 'Ignites' group's 30th anniversary,116,"""It wasn't [feasible] to host the event to test,"" said event organizer Ariq [Ariq Cabbler]. He said the problem stemmed from the denial of a request to keep the sound system on until 6:30 p.m. ""We didn't submit a permit this year [for the Montrose Location].""",Newspapers,"Wilson, Jason Carson",News,46,"Chicago, Ill.","Aug 13, 2014",Windy City Times,2014,29
118. Summer staycations,TRUE,Summer staycations,117,"""Nearly 30 years ago, when AIDS Foundation of Chicago was founded, we were faring a very different age in this epidemic,"" AFC Executive Director John PeLLer said. ""We've made a tremendous amount of progress in the fight against HIV.""",Newspapers,"Simonette, Matt",News,35,"Chicago, Ill.","May 28, 2014",Windy City Times,2014,29
119. Lay Me Down Softly,TRUE,Lay Me Down Softly,118,"Ibsen appears right next to Chekhov on the syllabus, but Calamity West's The Doll's House Project-subtitled ""Ibsen is Dead""-isn't your classroom version so much as it's an exploration of domestic politics in 1989 America, with Interrobang Theatre Project's production continuing through June 8 (773-935-6875).",Newspapers,"Barnidge, Mary Shen",News,35,"Chicago, Ill.","May 28, 2014",Windy City Times,2014,29
120. LGBT advocates praise VAWA guidelines,TRUE,LGBT advocates praise VAWA guidelines,119,"[Billy Roche], you see, isn't content to treat us Like the rubes come to pay strangers for the illusions that are [Theo Delaney]'s stock-in-trade, but instead regards us as contemplative observers more interested in the backstage dynamics of its personnel-blustery Theo, the boss; sexy Lily, his box-office manager; swaggering Dean, the aforementioned Killer; gentle Peader, his trainer, and laconic Junior, now the resident handyman, but himself a former pro boxer before being sidelined by a foot injury....",Newspapers,"Barnidge, Mary Shen",Theater Review,32,"Chicago, Ill.","May 7, 2014",Windy City Times,2014,29
121. Woman fights for right to 'walk while trans',TRUE,Woman fights for right to 'walk while trans',120,"The coalition also announced that ""the Office of Violence Against Women in the Department of Justice (OVW) announced a framework for analyzing the Limited conditions for services that are segregated or specific to gender and prohibited justifications based on overbroad assumptions or past practice."" Lastly, the group urged other federal agencies to follow ""the Lead of the Department of Justice and [apply] similar...",Newspapers,Anonymous,News,32,"Chicago, Ill.","May 7, 2014",Windy City Times,2014,29
122. Is CeCe McDonald Free?,TRUE,Is CeCe McDonald Free?,121,"[Jones]-who describes herself as an ""outspoken activist for human rights""-maintains that Project Rose paints all sex workers in Phoenix with the same brush. ""They treat us Like we are all selling our bodies for drugs,"" she said. ""That wasn't my story so I didn't take to it. I told them that I have a right to my own body. 'You cannot tell me what to do with my body' I said, so they rushed me through the program.",Newspapers,"Blickensderfer, Gretchen Rachel",News,28,"Chicago, Ill.","Apr 9, 2014",Windy City Times,2014,29
123. LGBT rights among topics discussed at immigration summit,TRUE,LGBT rights among topics discussed at immigration summit,122,"[CeCe McDonald]'s case has brought renewed awareness of the violence faced by transgender women of color. We are in the midst of an energized public conversation about transgender rights, due in part to McDonald's own activism, and that of supporters [Laverne Cox], Janet Mock, Leslie Feinberg, GLAAD, The Sylvia Rivera Law Project, and others. But there are still so many stories that need to be told in order for all of us to be free-including McDonald's forthcoming documentary.",Newspapers,"Royster, Francesca",Commentary,24,"Chicago, Ill.","Mar 12, 2014",Windy City Times,2014,29
124. CALENDAR,TRUE,CALENDAR,123,"For the first time, the ICIRR summit featured a workshop focusing on the needs of the LGBT immigrant community.",Newspapers,"Maxwell, Carrie",News,22,"Chicago, Ill.","Feb 26, 2014",Windy City Times,2014,29
125. Rachelle Brown works on LGBT religious issues,TRUE,Rachelle Brown works on LGBT religious issues,124,"Lipstick and Dynamite, Piss and Vinegar: The First Ladies of Wrestling"" Screening 11th Annual Dyke Delicious presents Lipstick and Dynamite profiles the amazing and often excruciating history of female wrestling from its origins as a circus side-show in the 1930's (banned in many states due to indecency), to it's ""hey-day"" in the 1950's and 60's where it soared in popularity.",Newspapers,Anonymous,General Information,20,"Chicago, Ill.","Feb 12, 2014",Windy City Times,2014,29
126. Looking back: Sports & Entertainment 2013,TRUE,Looking back: Sports & Entertainment 2013,125,"""It's a real interesting mix of people who are involved [with the church, driven by] their passion for this real openness and this real spiritual path mission,"" she said. ""What we're asking people to believe is faith and spirituality. They're doing it and we're doing things in a radical way.""",Newspapers,"Forman, Ross",News,14,"Chicago, Ill.","Jan 1, 2014",Windy City Times,2014,29
127. Looking back The year in national news,TRUE,Looking back The year in national news,126,"Oh, the ""Horror"": The third season of the FX show American Horror Story-called American Horror Story: Coven-featured actresses Patti LuPone and Angela Bassett. Producer [Ryan Murphy] (who also helms GLee) tweeted, ""Two legends are joining the cast of American Horror Story: Coven -Oscar nominee Angela Bassett and [Tony] winner Patti LuPone!"" LuPone and Bassett joned Sarah Paulson, Evan Peters and Frances Conroy as well as new actors Kathy Bates and Gabourey Sidibe (Precious).",Newspapers,"Davis, Andrew",Feature,13,"Chicago, Ill.","Dec 25, 2013",Windy City Times,2013,29
128. What's up next for Chicago's Catholics?,TRUE,What's up next for Chicago's Catholics?,127,"-Gates way: More than two years after playing an influential role in the [Obama] administration's repeal of ""Don't Ask, Don't Tell,"" former U.S. Secretary of Defense Robert Gates was named president-elect of the Boy Scouts of America. The Boy Scouts voted in May to approve a resolution removing any ban on members based on sexual orientation alone, although gay Scout Leaders are still prohibited. The policy change is slated to take effect Jan. 1, 2014.",Newspapers,"Davis, Andrew",News,13,"Chicago, Ill.","Dec 25, 2013",Windy City Times,2013,29
129. CALENDAR,TRUE,CALENDAR,128,"The Rainbow Sash Movement hopes the next Leader of the Archdiocese of Chicago is both humble and a servant. He needs to be open to a diversity of opinions; and 'Yes,' we think he should sit down with the LGBT Chicago political Leadership to really understand those concerns.",Newspapers,"Colbert, Chuck",News,11,"Chicago, Ill.","Dec 11, 2013",Windy City Times,2013,29
130. DICK Durbin visits Center on Halsted,TRUE,DICK Durbin visits Center on Halsted,129,"Divalia'ous"" Sunday brunch Diva Madam X will welcome ""Jingle Bell Brunch"" guesb with a variety of holiday tunes, musicab and seasonal sing-along favorites. Kit Katb seven projection screens will show holiday movies, from hilarious (Christmas Vacation, Elf) to heartwarming (It's a Wonderful Life, White Christmas). Chef JoAnn Witherell's brunch menu may be paired with an optional drink package for an additional $10 per person.",Newspapers,Anonymous,General Information,11,"Chicago, Ill.","Dec 11, 2013",Windy City Times,2013,29
131. Life after marriage (equality),TRUE,Life after marriage (equality),130,"[Dick Durbin] attended the ceremony wherein President Obama signed the repeal of ""Don't Ask, Don't Tell,"" where Cammermeyer recited pledge of allegiance. ""I thought, This has come full-circle/"" he said. ""She was the illustration of the challenge we face, and now she was here to celebrate as we start to come to grips with it.""",Newspapers,"Simonette, Matt",News,10,"Chicago, Ill.","Dec 4, 2013",Windy City Times,2013,29
132. Coming Out for Community,TRUE,Coming Out for Community,131,"There are two major things about being LGBT that continue to dent our arc in its search for justice: internalized homophobia and familial homophobia. Sarah Schulman writes about this in Ties that Bind: Familial Homophobia and Its Consequences. This is the damage that occurs in families, something that all of the societal acceptance in the world can't easily unpack. There are families who try to cure their LGBT youth, are violent toward them, kick them out and shun them.",Newspapers,"Baim, Tracy",Commentary,7,"Chicago, Ill.","Nov 13, 2013",Windy City Times,2013,29
133. Queer South Asian activist wades into marriage battle,TRUE,Queer South Asian activist wades into marriage battle,132,"The queer community has been a huge source of support economically, emotionally and socially. I would not be where I am if not for a dozens of people who offered me something I had no idea how to get on my own, people who afforded me their guidance and attention, people who did me small and large favors along the way. Thank you to my roommate who gave me clothes to wear to my first professional job when I was broke.",Newspapers,"Pérez, André",Commentary,3,"Chicago, Ill.","Oct 16, 2013",Windy City Times,2013,29
134. LGBT domestic-violence murder stats stun advocates,TRUE,LGBT domestic-violence murder stats stun advocates,133,"""In the South Asian community, I think it's more split, but in some of the East Asian organizations, people that I've spoken to, they're a Little more aligned with the Black and Latino queer communities where [marriage is] not helpful for certain segments of the population,"" [Naomi Anurag Lahiri] said. ""Or if it is, it's not the first priority when someone's homeless or thinking about killing themselves.""",Newspapers,"Sosin, Kate",News,3,"Chicago, Ill.","Oct 16, 2013",Windy City Times,2013,29
135. Talking with the ladies behind the BlogHer conference,TRUE,Talking with the ladies behind the BlogHer conference,134,"""Surprising? No,"" said [Jane Merrill]. ""Horrifying? Yes...this is a really terrifying report with the highest number of homicides ever recorded.""",Newspapers,"Sosin, Kate",News,2,"Chicago, Ill.","Oct 9, 2013",Windy City Times,2013,29
136. 'March on Springfield' to take place Oct. 22,TRUE,'March on Springfield' to take place Oct. 22,135,"KB: I recently graduated with my master's in education. I'm searching for a teaching job while balanring my online identity and performing poet identity with my teaching identity. While I'm extremely proud of the identity and following I've developed online as a blogger and performing poet, it has actually presented me with unexpected challenges in finding a job.",Newspapers,"Toce, Sarah",Feature,42,"Chicago, Ill.","Jul 24, 2013",Windy City Times,2013,28
137. Lane Tech teacher out and proud,TRUE,Lane Tech teacher out and proud,136,"[Tracy Bairn] is pubLisher and executive editor at Windy City Media Group, which produces Windy City Times, Nightspots, and other gay media in Chicago. She co-founded Windy City Times in 1985. She has won numerous gay community and journalism honors, including the Community Media Workshop's Studs Terkel Award. Bairn is the editor and co-author of several books on gay history, gay media and politics. Bairn served as covice chair of the Chicago Gay Games board.",Newspapers,Anonymous,Feature,40,"Chicago, Ill.","Jul 3, 2013",Windy City Times,2013,28
"138. Rev. Nancy Wilson, MCC conference headed to Chicago",TRUE,"Rev. Nancy Wilson, MCC conference headed to Chicago",137,"When [Courtney Feuer] told schooL administrators that she was on going on maternity Leave, she met with the assistant principaL who was known for being very religious, very conservative. ""When I Left her office that day, she said, 'Congratulations and pLease teLl your husband congratuLations, too,'"" Feuer recalled.",Newspapers,"Forman, Ross",News,38,"Chicago, Ill.","Jun 26, 2013",Windy City Times,2013,28
"139. Beth Richie on race, gender and the 'prison nation'",TRUE,"Beth Richie on race, gender and the 'prison nation'",138,"NW: I feel very optimistic. I don't think we'll get everything we want, but I believe DOMA will be overturned. It doesn't mean gay marriage will be universal in our country-thafs another fight, I'm afraid-but you can see the momen- tum of change in the world and the United States. For DOMA to coLLapse would be huge, but then the deeper fight is on the way. Ifs still a cause for enormous hope.",Newspapers,"Duff, Deanna",Interview,37,"Chicago, Ill.","Jun 19, 2013",Windy City Times,2013,28
140. Bar association offers training regarding LGBT domestic abuse,TRUE,Bar association offers training regarding LGBT domestic abuse,139,"If you're a woman, things are much worse, because our communities don't attend to the ways that we're under the controL of the prison nation. That doesn't rise up to a community priority.",Newspapers,"Nair, Yasmin",Interview,33,"Chicago, Ill.","May 22, 2013",Windy City Times,2013,28
"141. Center on Halsted's gala puts Chaka Khan, honorees on center stage",TRUE,"Center on Halsted's gala puts Chaka Khan, honorees on center stage",140,"""Feel free to walk out now if you don't want to get in touch with your feelings,"" said Director of Education &amp; Victim Advocacy at the Center on Halsted lisa Gilmore, getting a few chuckles in response. ""C'mon, ifs lunch time.""",Newspapers,"Clark, Matthew C",News,33,"Chicago, Ill.","May 22, 2013",Windy City Times,2013,28
142. State's Attorney's LGBTQ/hate crime specialist talks crime and justice,TRUE,State's Attorney's LGBTQ/hate crime specialist talks crime and justice,141,"There was this feeLing to the evening about famiLy and that we've come aLong way and we're recognizing the whoLe famiLy as we're heading toward fuLL equality,"" said [Modesto ""Tico"" Valle]. ""It is an opportunity to bring community together and to reaLLy ceLebrate aLL the accomplishments and recognize some very important people in our community. That to me was reaLLy the feeLing Last night. The only sadness is that we weren't ceLebrating fuLL [marriage] equality.",Newspapers,"Wasserman, Melissa",News,33,"Chicago, Ill.","May 22, 2013",Windy City Times,2013,28
143. With Malice Aforethought: LGBTQs and the criminal justice system,TRUE,With Malice Aforethought: LGBTQs and the criminal justice system,142,"AO: Yes, that's absolutely challenging to me. I don't know of a perfert system at this point, so ifs hard to say what would be preferabLe. There are Lots of things that give me pause in terms of how are we treating peopLe, whether there is enough restorative justice going on, I absoLutely think those conversations shouLd be happening and are happening. It's not necessarily helpfuL to just Lock that person up and throw away the key.",Newspapers,"Chaitman, Steven",Interview,32,"Chicago, Ill.","May 15, 2013",Windy City Times,2013,28
144. Congregation Or Chadash welcomes new rabbi,TRUE,Congregation Or Chadash welcomes new rabbi,143,"Ignoring violence. Neighborhoods perceived as ""gay"" have often been targeted by gay-bashers and seriaL kiLLers. In the past, because poLice ignored the crimes or often treated them with LittLe seriousness, LGBTs organized their own street patrols and response, including a whistLe-blowing campaign in 1970s Chicago, and a 1980s Pink Angels group.",Newspapers,"Baim, Tracy",Feature,31,"Chicago, Ill.","May 8, 2013",Windy City Times,2013,28
"145. Obama signs VAWA, singles out gay center",TRUE,"Obama signs VAWA, singles out gay center",144,"""I'm very excited,"" [Cindy Enger] said. ""Ifs a great opportunity with Lots of potential to grow with the community and to deepen what it means to be in synagogue community together.""",Newspapers,"Sosin, Kate",News,30,"Chicago, Ill.","May 1, 2013",Windy City Times,2013,28
146. State of the Union address garners mixed reviews,TRUE,State of the Union address garners mixed reviews,145,"It also includes funding for ""underserved"" populations ""who face barriers in accessing and using victim services because of various reasons, including because of sexual orientation and gender identity."" And it provides that certain grants under the Omnibus Crime Control and Safe Streets Act can be used for ""developing, enlarging, or strengthening programs and projects to provide services and responses targeting male and female victims of domestic violence ... whose ability to access...",Newspapers,"Keen, Lisa",News,23,"Chicago, Ill.","Mar 13, 2013",Windy City Times,2013,28
147. calendar Q,TRUE,calendar Q,146,"We have often said that President [MicheLLe Obama] is the most pro-LGBT president in history. His first term was fiLLed with monumental gains for LGBT people and our famiLies, incLuding the passage of a federaL hate-crimes Law, repeal of 'Don't Ask, Don't TeLL' and his decLaration of support for the freedom to marry for same-sex coupLes,"" said [Rea Carey]. ""But the state of the union, for many LGBT peopLe, remains one of economic inequality and insecurity.",Newspapers,"Keen, Lisa",News,20,"Chicago, Ill.","Feb 20, 2013",Windy City Times,2013,28
148. 'Vagina Monologues' in Aurora Feb. 15,TRUE,'Vagina Monologues' in Aurora Feb. 15,147,"Heather McDonald Writer, performer and story producer for ""Chelsea Lately"" and ""After Lately"" and has abo appeared on ""Frasier"", ""Malcolm in the Middle"", ""Reno 911."" Through Feb. 16. 9:30pm, Zanies Comedy Club, 1548 ? Wells St., also St. Charles and Rosemont; www.zanies.com",Newspapers,Anonymous,General Information,19,"Chicago, Ill.","Feb 13, 2013",Windy City Times,2013,28
149. 'Vagina Monologues' in Aurora Feb. 15,TRUE,'Vagina Monologues' in Aurora Feb. 15,148,"For more information or to order tickets, contact Razena Unwin at 630-222-1174 or razena@razena.net, or visit www.razena.net/ VDayAurora.htmL.",Newspapers,Anonymous,News,19,"Chicago, Ill.","Feb 13, 2013",Windy City Times,2013,28
150. Seeing a future beyond formal LGBT equality: Talking with Urvashi Vaid,TRUE,Seeing a future beyond formal LGBT equality: Talking with Urvashi Vaid,149,"For more information or to order tickets, contact Razena Unwin at 630-222-1174 or razena@razena.net, or visit www.razena.net/ VDayAurora.html.",Newspapers,Anonymous,News,18,"Chicago, Ill.","Feb 6, 2013",Windy City Times,2013,28
151. Teen Living Programs serves homeless youth on South Side,TRUE,Teen Living Programs serves homeless youth on South Side,150,"""But no,"" she said, ""I don't think we have done a very good job"" or ""have made any progress"" in adding, for instance ""issues of poverty,"" HIV/AIDS health disparities, and other concerns to a gay-rights agenda, including ""criminal justice issues, women's issues - vioLence against women, women earning Less than men - or expanding the definition of family in welfare programs to enable Low-income Lesbians with kids to be covered.""",Newspapers,"Colbert, Chuck",News,15,"Chicago, Ill.","Jan 16, 2013",Windy City Times,2013,28
"152. Actress Sheryl Lee Ralph talks HIV/AIDS activism, 'Divas'",TRUE,"Actress Sheryl Lee Ralph talks HIV/AIDS activism, 'Divas'",151,"The reality is, most of what we do as service providers is react,"" [Lynch Linas] said. ""ALL the services [we offer] are a reaction to those aLready experiencing homeLessness. How do we address the fact that these young peopLe are homeLess because of poverty, because of in adequate housing, because of domestic violence, because of substance abuse? ...",Newspapers,"Royce, Jamie Anne",News,12,"Chicago, Ill.","Dec 26, 2012",Windy City Times,2012,28
153. Intimate partner violence report cites lack of access,TRUE,Intimate partner violence report cites lack of access,152,"SLR: I'm so shocked that I'm about to raise the curtain on the 22nd annuaL ""Divas Simply Singing."" If anybody had ever toLd me that it wouLd be 22 years, I wouLd've said, ""You're crazy. There'LL be a cure. There'LL be something. There'd be no need for 'Divas SimpLy Singing.'""",Newspapers,"Davis, Andrew",Interview,8,"Chicago, Ill.","Nov 28, 2012",Windy City Times,2012,28
154. Playing with porn,TRUE,Playing with porn,153,"[Lisa Gilmore] noted that LGBTQH men were about twice as Likely to experience injuries when compared to the overaLL group, and that the majority of intimate partner vioLence homicide victims reported were LGBTQH men. She also noted that people of co Lor under 30 years old were four times more Likely to report experience physical vioLence and were about twice as Likely to be injured as a result of intimate partner vioLence.",Newspapers,"Clark, Matthew C",News,52,"Chicago, Ill.","Oct 17, 2012",Windy City Times,2012,28
